Symbol,Nasdaq Traded,Security Name,Listing Exchange,Market Category,ETF,Round Lot Size,Test Issue,Financial Status,CQS Symbol,NASDAQ Symbol,NextShares
DWLD,True,Davis Select Worldwide ETF,Q,G,True,100.0,False,N,,DWLD,False
DWLV,True,PowerShares DWA Momentum & Low Volatility Rotation Portfolio,Q,G,True,100.0,False,N,,DWLV,False
DWM,True,WisdomTree International Equity Fund,P, ,True,100.0,False,,DWM,DWM,False
DWPP,True,First Trust Dorsey Wright People's Portfolio ETF,Q,G,True,100.0,False,N,,DWPP,False
DWSN,True,Dawson Geophysical Company - Common Stock,Q,Q,False,100.0,False,N,,DWSN,False
DWT,True,VelocityShares 3x Inverse Crude Oil ETNs linked to the S&P GSCI Crude Oil Index ER,P, ,True,100.0,False,,DWT,DWT,False
DWTR,True,PowerShares DWA Tactical Sector Rotation Portfolio,Q,G,True,100.0,False,N,,DWTR,False
DWX,True,SPDR S&P International Dividend ETF,P, ,True,100.0,False,,DWX,DWX,False
DX,True,"Dynex Capital, Inc. Common Stock",N, ,False,100.0,False,,DX,DX,False
DX$A,True,"Dynex Capital, Inc. Preferred Stock Series A",N, ,False,100.0,False,,DXpA,DX-A,False
DX$B,True,"Dynex Capital, Inc. Preferred Series B",N, ,False,100.0,False,,DXpB,DX-B,False
DXB,True,Deutsche Bk Contingent Cap TR II Tr Pfd Sec,N, ,False,100.0,False,,DXB,DXB,False
DXC,True,DXC Technology Company Common Stock ,N, ,False,100.0,False,,DXC,DXC,False
DXCM,True,"DexCom, Inc. - Common Stock",Q,Q,False,100.0,False,N,,DXCM,False
DXD,True,ProShares UltraShort Dow30,P, ,True,100.0,False,,DXD,DXD,False
DXF,True,Dunxin Financial Holdings Limited American Depositary Shares,A, ,False,100.0,False,,DXF,DXF,False
DXGE,True,WisdomTree Germany Hedged Equity Fund,Q,G,True,100.0,False,N,,DXGE,False
DXJ,True,WisdomTree Japan Hedged Equity Fund,P, ,True,100.0,False,,DXJ,DXJ,False
DXJF,True,WisdomTree Japan Hedged Financials Fund,P, ,True,100.0,False,,DXJF,DXJF,False
DXJS,True,WisdomTree Japan Hedged SmallCap Equity Fund,Q,G,True,100.0,False,N,,DXJS,False
DXLG,True,"Destination XL Group, Inc. - Common Stock",Q,Q,False,100.0,False,N,,DXLG,False
DXPE,True,"DXP Enterprises, Inc. - Common Stock",Q,Q,False,100.0,False,N,,DXPE,False
DXR,True,Daxor Corporation Common Stock,A, ,False,100.0,False,,DXR,DXR,False
DXYN,True,"The Dixie Group, Inc. - Common Stock",Q,G,False,100.0,False,N,,DXYN,False
DY,True,"Dycom Industries, Inc. Common Stock",N, ,False,100.0,False,,DY,DY,False
DYB,True,WisdomTree Dynamic Bearish U.S. Equity Fund,Z, ,True,100.0,False,,DYB,DYB,False
DYLS,True,WisdomTree Dynamic Long/Short U.S. Equity Fund,Z, ,True,100.0,False,,DYLS,DYLS,False
DYN,True,Dynegy Inc. Common Stock,N, ,False,100.0,False,,DYN,DYN,False
DYN.A,True,"Dynegy Inc. Warrants to purchase Common Stock (Expirig February 2, 2024)",N, ,False,100.0,False,,DYN.WS.A,DYN+A,False
DYNC,True,Dynegy Inc. 7.00% Tangible Equity Units,N, ,False,100.0,False,,DYNC,DYNC,False
DYNT,True,Dynatronics Corporation - Common Stock,Q,S,False,100.0,False,N,,DYNT,False
DYSL,True,Dynasil Corporation of America - Common Stock,Q,S,False,100.0,False,N,,DYSL,False
DYY,True,"DB Commodity Double Long ETN due April 1, 2038",P, ,False,100.0,False,,DYY,DYY,False
DZK,True,Direxion Developed Markets Bull 3x Shares,P, ,True,100.0,False,,DZK,DZK,False
DZSI,True,"DASAN Zhone Solutions, Inc. - Common Stock",Q,S,False,100.0,False,N,,DZSI,False
DZZ,True,"DB Gold Double Short ETN due February 15, 2038",P, ,False,100.0,False,,DZZ,DZZ,False
E,True,ENI S.p.A. Common Stock,N, ,False,100.0,False,,E,E,False
EA,True,Electronic Arts Inc. - Common Stock,Q,Q,False,100.0,False,N,,EA,False
EAB,True,"Entergy Arkansas, Inc. First Mortgage Bonds, 4.90% Series Due December 1, 2052",N, ,False,100.0,False,,EAB,EAB,False
EACQ,True,Easterly Acquisition Corp. - Common Stock,Q,S,False,100.0,False,N,,EACQ,False
EACQU,True,Easterly Acquisition Corp. - Unit,Q,S,False,100.0,False,N,,EACQU,False
EACQW,True,Easterly Acquisition Corp. - Warrant,Q,S,False,100.0,False,N,,EACQW,False
EAD,True,Wells Fargo Income Opportunities Fund Common Shares,A, ,False,100.0,False,,EAD,EAD,False
EAE,True,"Entergy Arkansas, Inc. First Mortgage Bonds, 4.75% Series due June 1, 2063",N, ,False,100.0,False,,EAE,EAE,False
EAGL,True,Platinum Eagle Acquisition Corp. - Class A Ordinary Shares,Q,S,False,100.0,False,N,,EAGL,False
EAGLU,True,Platinum Eagle Acquisition Corp. - Unit,Q,S,False,100.0,False,N,,EAGLU,False
EAGLW,True,Platinum Eagle Acquisition Corp. - Warrant,Q,S,False,100.0,False,N,,EAGLW,False
EAI,True,"Entergy Arkansas, Inc. First Mortgage Bonds, 4.875% Series Due September 1, 2066",N, ,False,100.0,False,,EAI,EAI,False
EARN,True,Ellington Residential Mortgage REIT Common Shares of Beneficial Interest,N, ,False,100.0,False,,EARN,EARN,False
EARS,True,Auris Medical Holding AG - Common Shares,Q,S,False,100.0,False,D,,EARS,False
EAST,True,"Eastside Distilling, Inc. - Common Stock",Q,S,False,100.0,False,N,,EAST,False
EASTW,True,"Eastside Distilling, Inc. - Warrants",Q,S,False,100.0,False,N,,EASTW,False
EAT,True,"Brinker International, Inc. Common Stock",N, ,False,100.0,False,,EAT,EAT,False
EBAY,True,eBay Inc. - Common Stock,Q,Q,False,100.0,False,N,,EBAY,False
EBAYL,True,eBay Inc. - 6.0% Notes Due 2056,Q,Q,False,100.0,False,N,,EBAYL,False
EBF,True,"Ennis, Inc. Common Stock",N, ,False,100.0,False,,EBF,EBF,False
EBIO,True,"Eleven Biotherapeutics, Inc. - Common Stock",Q,G,False,100.0,False,N,,EBIO,False
EBIX,True,"Ebix, Inc. - Common Stock",Q,Q,False,100.0,False,N,,EBIX,False
EBMT,True,"Eagle Bancorp Montana, Inc. - Common Stock",Q,G,False,100.0,False,N,,EBMT,False
EBND,True,SPDR Bloomberg Barclays Emerging Markets Local Bond ETF,P, ,True,100.0,False,,EBND,EBND,False
EBR,True,Centrais Electricas Brasileiras S A American Depositary Shares (Each representing one Common Share),N, ,False,100.0,False,,EBR,EBR,False
EBR.B,True,Centrais Electricas Brasileiras S.A.- Eletrobr?!s American Depositary Shares (Each representing one Preferred Share),N, ,False,100.0,False,,EBR.B,EBR.B,False
EBS,True,"Emergent Biosolutions, Inc. Common Stock",N, ,False,100.0,False,,EBS,EBS,False
EBSB,True,"Meridian Bancorp, Inc. - Common Stock",Q,Q,False,100.0,False,N,,EBSB,False
EBTC,True,Enterprise Bancorp Inc - Common Stock,Q,Q,False,100.0,False,N,,EBTC,False
EC,True,Ecopetrol S.A. American Depositary Shares,N, ,False,100.0,False,,EC,EC,False
ECA,True,Encana Corporation,N, ,False,100.0,False,,ECA,ECA,False
ECC,True,Eagle Point Credit Company Inc. Common Stock,N, ,False,100.0,False,,ECC,ECC,False
ECCA,True,Eagle Point Credit Company Inc. Series A Term Preferred Stock due 2022,N, ,False,100.0,False,,ECCA,ECCA,False
ECCB,True,Eagle Point Credit Company Inc. 7.75% Series B Term Preferred Stock due 2026,N, ,False,100.0,False,,ECCB,ECCB,False
ECCY,True,Eagle Point Credit Company Inc. 6.75% Notes due 2027,N, ,False,100.0,False,,ECCY,ECCY,False
ECCZ,True,Eagle Point Credit Company Inc. 7.00% Notes due 2020,N, ,False,100.0,False,,ECCZ,ECCZ,False
ECF,True,Ellsworth Growth and Income Fund Ltd.,A, ,False,100.0,False,,ECF,ECF,False
ECF$A,True,Ellsworth Growth and Income Fund Ltd. 5.25% Series A Cumulative Preferred Shares (Liquidation Preference $25.00 per share),A, ,False,100.0,False,,ECFpA,ECF-A,False
ECH,True,iShares Inc. iShares MSCI Chile ETF,Z, ,True,100.0,False,,ECH,ECH,False
ECHO,True,"Echo Global Logistics, Inc. - Common Stock",Q,Q,False,100.0,False,N,,ECHO,False
ECL,True,Ecolab Inc. Common Stock,N, ,False,100.0,False,,ECL,ECL,False
ECNS,True,iShares MSCI China Small-Cap ETF,P, ,True,100.0,False,,ECNS,ECNS,False
ECOL,True,"US Ecology, Inc. - Common Stock",Q,Q,False,100.0,False,N,,ECOL,False
ECOM,True,ChannelAdvisor Corporation Common Stock,N, ,False,100.0,False,,ECOM,ECOM,False
ECON,True,Columbia Emerging Markets Consumer ETF,P, ,True,100.0,False,,ECON,ECON,False
ECPG,True,Encore Capital Group Inc - Common Stock,Q,Q,False,100.0,False,N,,ECPG,False
ECR,True,Eclipse Resources Corporation Common Stock,N, ,False,100.0,False,,ECR,ECR,False
ECT,True,ECA Marcellus Trust I Common Units of Beneficial Interest,N, ,False,100.0,False,,ECT,ECT,False
ECYT,True,"Endocyte, Inc. - Common Stock",Q,Q,False,100.0,False,N,,ECYT,False
ED,True,"Consolidated Edison, Inc. Common Stock",N, ,False,100.0,False,,ED,ED,False
EDAP,True,"EDAP TMS S.A. - American Depositary Shares, each representing One Ordinary Share",Q,G,False,100.0,False,N,,EDAP,False
EDBI,True,Legg Mason Emerging Markets Diversified Core ETF,Q,G,True,100.0,False,N,,EDBI,False
EDC,True,Direxion Emerging Markets Bull 3X Shares,P, ,True,100.0,False,,EDC,EDC,False
EDD,True,"Morgan Stanley Emerging Markets Domestic Debt Fund, Inc. Morgan Stanley Emerging Markets Domestic Debt Fund, Inc. Common Stock",N, ,False,100.0,False,,EDD,EDD,False
EDEN,True,iShares Inc iShares MSCI Denmark ETF,Z, ,True,100.0,False,,EDEN,EDEN,False
EDF,True,Stone Harbor Emerging Markets Income Fund Common Shares of Beneficial Interest,N, ,False,100.0,False,,EDF,EDF,False
EDGE,True,"Edge Therapeutics, Inc. - Common Stock",Q,Q,False,100.0,False,N,,EDGE,False
EDGW,True,"Edgewater Technology, Inc. - Common Stock",Q,G,False,100.0,False,N,,EDGW,False
EDI,True,Stone Harbor Emerging Markets Total Income Fund Common Shares of Beneficial Interests,N, ,False,100.0,False,,EDI,EDI,False
EDIT,True,"Editas Medicine, Inc. - Common Stock",Q,Q,False,100.0,False,N,,EDIT,False
EDIV,True,SPDR S&P Emerging Markets Dividend ETF,P, ,True,100.0,False,,EDIV,EDIV,False
EDN,True,Empresa Distribuidora Y Comercializadora Norte S.A. (Edenor) Empresa Distribuidora Y Comercializadora Norte S.A. (Edenor) American Depositary Shares,N, ,False,100.0,False,,EDN,EDN,False
EDOG,True,ALPS Emerging Sector Dividend Dogs ETF,P, ,True,100.0,False,,EDOG,EDOG,False
EDOM,True,WisdomTree Europe Domestic Economy Fund,Z, ,True,100.0,False,,EDOM,EDOM,False
EDOW,True,First Trust Dow 30 Equal Weight ETF,P, ,True,100.0,False,,EDOW,EDOW,False
EDR,True,"Education Realty Trust, Inc. Common Stock",N, ,False,100.0,False,,EDR,EDR,False
EDU,True,"New Oriental Education & Technology Group, Inc. Sponsored ADR representing 1 Ordinary Share (Cayman Islands)",N, ,False,100.0,False,,EDU,EDU,False
EDUC,True,Educational Development Corporation - Common Stock,Q,G,False,100.0,False,N,,EDUC,False
EDV,True,Vanguard Extended Duration Treasury ETF,P, ,True,100.0,False,,EDV,EDV,False
EDZ,True,Direxion Emerging Markets Bear 3X Shares,P, ,True,100.0,False,,EDZ,EDZ,False
EE,True,El Paso Electric Company Common Stock,N, ,False,100.0,False,,EE,EE,False
EEA,True,"The European Equity Fund, Inc. Common Stock",N, ,False,100.0,False,,EEA,EEA,False
EEB,True,Guggenheim BRIC ETF,P, ,True,100.0,False,,EEB,EEB,False
EEFT,True,"Euronet Worldwide, Inc. - Common Stock",Q,Q,False,100.0,False,N,,EEFT,False
EEH,True,"Aktiebolaget Svensk Exportkredit (Swed Ex Cred Corp) Elements (SM) Linked to the SPECTRUM Large Cap U.S. Sector Momentum Index developed by BNP Paribas due August 8, 2022, Medium-Term Notes, Series D",P, ,False,100.0,False,,EEH,EEH,False
EEI,True,"Ecology and Environment, Inc. - Class A Common Stock",Q,G,False,100.0,False,N,,EEI,False
EELV,True,PowerShares S&P Emerging Markets Low Volatility Portfolio,P, ,True,100.0,False,,EELV,EELV,False
EEM,True,iShares MSCI Emerging Index Fund,P, ,True,100.0,False,,EEM,EEM,False
EEMA,True,iShares MSCI Emerging Markets Asia Index Fund,Q,G,True,100.0,False,N,,EEMA,False
EEMD,True,AAM S&P Emerging Markets High Dividend Value ETF,P, ,True,100.0,False,,EEMD,EEMD,False
EEMO,True,PowerShares S&P Emerging Markets Momentum Portfolio,P, ,True,100.0,False,,EEMO,EEMO,False
EEMS,True,Ishares MSCI Emerging Markets Small Cap Index Fund,P, ,True,100.0,False,,EEMS,EEMS,False
EEMV,True,iShares Edge MSCI Min Vol Emerging Markets ETF,Z, ,True,100.0,False,,EEMV,EEMV,False
EEMX,True,SPDR MSCI Emerging Markets Fuel Reserves Free ETF,P, ,True,100.0,False,,EEMX,EEMX,False
EEP,True,"Enbridge Energy, L.P. Class A Common Units",N, ,False,100.0,False,,EEP,EEP,False
EEQ,True,Enbridge Energy Management LLC Shares repstg limited liability company interests,N, ,False,100.0,False,,EEQ,EEQ,False
EES,True,WisdomTree U.S. SmallCap Earnings Fund,P, ,True,100.0,False,,EES,EES,False
EET,True,ProShares Ultra MSCI Emerging Markets,P, ,True,100.0,False,,EET,EET,False
EEV,True,ProShares UltraShort MSCI Emerging Markets,P, ,True,100.0,False,,EEV,EEV,False
EEX,True,"Emerald Expositions Events, Inc. Common Stock",N, ,False,100.0,False,,EEX,EEX,False
EFA,True,iShares MSCI EAFE ETF,P, ,True,100.0,False,,EFA,EFA,False
EFAD,True,ProShares Trust ProShares MSCI EAFE Dividend Growers ETF,Z, ,True,100.0,False,,EFAD,EFAD,False
EFAS,True,Global X MSCI SuperDividend EAFE ETF,Q,G,True,100.0,False,N,,EFAS,False
EFAV,True,iShares Edge MSCI Min Vol EAFE ETF,Z, ,True,100.0,False,,EFAV,EFAV,False
EFAX,True,SPDR MSCI EAFE Fossil Fuel Reserves Free ETF,P, ,True,100.0,False,,EFAX,EFAX,False
EFBI,True,"Eagle Financial Bancorp, Inc. - Common Stock",Q,S,False,100.0,False,N,,EFBI,False
EFC,True,"Ellington Financial LLC Common Shares representing Limitied Liability Company Interests, no par valu",N, ,False,100.0,False,,EFC,EFC,False
EFF,True,Eaton vance Floating-Rate Income Plus Fund Common Shares of Beneficial Interest,N, ,False,100.0,False,,EFF,EFF,False
EFFE,True,Global X JPMorgan Efficiente Index ETF,P, ,True,100.0,False,,EFFE,EFFE,False
EFG,True,iShares MSCI EAFE Growth ETF,Z, ,True,100.0,False,,EFG,EFG,False
EFII,True,"Electronics for Imaging, Inc. - Common Stock",Q,Q,False,100.0,False,N,,EFII,False
EFL,True,Eaton Vance Floating-Rate 2022 Target Term Trust Common Shares of Beneficial Interest,N, ,False,100.0,False,,EFL,EFL,False
EFNL,True,iShares Inc iShares MSCI Finland ETF,Z, ,True,100.0,False,,EFNL,EFNL,False
EFO,True,ProShares Ultra MSCI EAFE,P, ,True,100.0,False,,EFO,EFO,False
EFOI,True,"Energy Focus, Inc. - Common Stock",Q,S,False,100.0,False,N,,EFOI,False
EFR,True,Eaton Vance Senior Floating-Rate Fund Common Shares of Beneficial Interest,N, ,False,100.0,False,,EFR,EFR,False
EFSC,True,Enterprise Financial Services Corporation - Common Stock,Q,Q,False,100.0,False,N,,EFSC,False
EFT,True,Eaton Vance Floating Rate Income Trust Common Shares of Beneficial Interest,N, ,False,100.0,False,,EFT,EFT,False
EFU,True,ProShares UltraShort MSCI EAFE,P, ,True,100.0,False,,EFU,EFU,False
EFV,True,iShares MSCI EAFE Value ETF,Z, ,True,100.0,False,,EFV,EFV,False
EFX,True,"Equifax, Inc. Common Stock",N, ,False,100.0,False,,EFX,EFX,False
EFZ,True,ProShares Short MSCI EAFE,P, ,True,100.0,False,,EFZ,EFZ,False
EGAN,True,eGain Corporation - Common Stock,Q,S,False,100.0,False,N,,EGAN,False
EGBN,True,"Eagle Bancorp, Inc. - Common Stock",Q,S,False,100.0,False,N,,EGBN,False
EGC,True,"Energy XXI Gulf Coast, Inc. - Common Stock",Q,Q,False,100.0,False,D,,EGC,False
EGF,True,"Blackrock Enhanced Government Fund, Inc. Common Stock",N, ,False,100.0,False,,EGF,EGF,False
EGHT,True,8x8 Inc Common Stock,N, ,False,100.0,False,,EGHT,EGHT,False
EGI,True,Entree Resources Ltd. Common Stock,A, ,False,100.0,False,,EGI,EGI,False
EGIF,True,Eagle Growth and Income Opportunities Fund Common Shares of Beneficial Interest,N, ,False,100.0,False,,EGIF,EGIF,False
EGL,True,"Engility Holdings, Inc. Common Stock",N, ,False,100.0,False,,EGL,EGL,False
EGLE,True,Eagle Bulk Shipping Inc. - Common Stock,Q,Q,False,100.0,False,N,,EGLE,False
EGLT,True,Egalet Corporation - Common Stock,Q,G,False,100.0,False,D,,EGLT,False
EGN,True,Energen Corporation Common Stock,N, ,False,100.0,False,,EGN,EGN,False
EGO,True,Eldorado Gold Corporation Ordinary Shares,N, ,False,100.0,False,,EGO,EGO,False
EGOV,True,NIC Inc. - Common Stock,Q,Q,False,100.0,False,N,,EGOV,False
EGP,True,"EastGroup Properties, Inc. Common Stock",N, ,False,100.0,False,,EGP,EGP,False
EGPT,True,VanEck Vectors Egypt Index ETF,P, ,True,100.0,False,,EGPT,EGPT,False
EGRX,True,"Eagle Pharmaceuticals, Inc. - Common Stock",Q,G,False,100.0,False,N,,EGRX,False
EGY,True,"VAALCO Energy, Inc.  Common Stock",N, ,False,100.0,False,,EGY,EGY,False
EHC,True,Encompass Health Corporation Common Stock,N, ,False,100.0,False,,EHC,EHC,False
EHI,True,Western Asset Global High Income Fund Inc Common Stock,N, ,False,100.0,False,,EHI,EHI,False
EHIC,True,eHi Car Services Limited American Depositary Shares,N, ,False,100.0,False,,EHIC,EHIC,False
EHT,True,Eaton Vance High Income 2021 Target Term Trust Common Shares of Beneficial Interest,N, ,False,100.0,False,,EHT,EHT,False
EHTH,True,"eHealth, Inc. - Common Stock",Q,Q,False,100.0,False,N,,EHTH,False
EIA,True,"Eaton Vance California Municipal Bond Fund II Common Shares of Beneficial Interest, $.01 par value",A, ,False,100.0,False,,EIA,EIA,False
EIDO,True,iShares MSCI Indonesia ETF,P, ,True,100.0,False,,EIDO,EIDO,False
EIG,True,Employers Holdings Inc Common Stock,N, ,False,100.0,False,,EIG,EIG,False
EIGI,True,"Endurance International Group Holdings, Inc. - Common Stock",Q,Q,False,100.0,False,N,,EIGI,False
EIGR,True,"Eiger BioPharmaceuticals, Inc. - Common Stock",Q,G,False,100.0,False,N,,EIGR,False
EIM,True,"Eaton Vance Municipal Bond Fund Common Shares of Beneficial Interest, $.01 par value",A, ,False,100.0,False,,EIM,EIM,False
EIO,True,"Eaton Vance Ohio Municipal Bond Fund Common Shared of Befeficial Interest, $.01 par value",A, ,False,100.0,False,,EIO,EIO,False
EIP,True,"Eaton Vance Pennsylvania Municipal Bond Fund Common Shares of Befeficial Interest, $.01 par value",A, ,False,100.0,False,,EIP,EIP,False
EIRL,True,iShares Trust iShares MSCI Ireland ETF,P, ,True,100.0,False,,EIRL,EIRL,False
EIS,True,iShares Inc iShares MSCI Israel ETF,P, ,True,100.0,False,,EIS,EIS,False
EIV,True,"Eaton Vance Municipal Bond Fund II Common Shares of Beneficial Interest, $.01 Par Value",A, ,False,100.0,False,,EIV,EIV,False
EIX,True,Edison International Common Stock,N, ,False,100.0,False,,EIX,EIX,False
EKAR,True,Innovation Shares NextGen Vehicles & Technology ETF,P, ,True,100.0,False,,EKAR,EKAR,False
EKSO,True,"Ekso Bionics Holdings, Inc. - Common Stock",Q,S,False,100.0,False,N,,EKSO,False
EL,True,"Estee Lauder Companies, Inc. (The) Common Stock",N, ,False,100.0,False,,EL,EL,False
ELC,True,"Entergy Louisiana, Inc. Collateral Trust Mortgage Bonds, 4.875 % Series due September 1, 2066",N, ,False,100.0,False,,ELC,ELC,False
ELD,True,WisdomTree Emerging Markets Local Debt Fund,P, ,True,100.0,False,,ELD,ELD,False
ELEC,True,Electrum Special Acquisition Corporation - Ordinary Shares,Q,S,False,100.0,False,N,,ELEC,False
ELECU,True,Electrum Special Acquisition Corporation - Unit,Q,S,False,100.0,False,N,,ELECU,False
ELECW,True,Electrum Special Acquisition Corporation - Warrants,Q,S,False,100.0,False,N,,ELECW,False
ELF,True,"e.l.f. Beauty, Inc. Common Stock",N, ,False,100.0,False,,ELF,ELF,False
ELGX,True,"Endologix, Inc. - Common Stock",Q,Q,False,100.0,False,N,,ELGX,False
ELJ,True,"Entergy Louisiana, Inc. First Mortgage Bonds, 5.25% Series due July 1, 2052",N, ,False,100.0,False,,ELJ,ELJ,False
ELLI,True,"Ellie Mae, Inc. Common Stock",N, ,False,100.0,False,,ELLI,ELLI,False
ELLO,True,Ellomay Capital Ltd Ordinary Shares (Israel),A, ,False,100.0,False,,ELLO,ELLO,False
ELMD,True,"Electromed, Inc. Common Stock",A, ,False,100.0,False,,ELMD,ELMD,False
ELON,True,Echelon Corporation - Common Stock,Q,Q,False,100.0,False,N,,ELON,False
ELP,True,Companhia Paranaense de Energia (COPEL) Common Stock,N, ,False,100.0,False,,ELP,ELP,False
ELS,True,"Equity Lifestyle Properties, Inc. Common Stock",N, ,False,100.0,False,,ELS,ELS,False
ELSE,True,"Electro-Sensors, Inc. - Common Stock",Q,S,False,100.0,False,N,,ELSE,False
ELTK,True,Eltek Ltd. - Ordinary Shares,Q,S,False,100.0,False,N,,ELTK,False
ELU,True,"Entergy Louisiana, Inc. First Mortgage Bonds, 4.70% Series due June 1, 2063",N, ,False,100.0,False,,ELU,ELU,False
ELVT,True,"Elevate Credit, Inc. Common Stock",N, ,False,100.0,False,,ELVT,ELVT,False
ELY,True,Callaway Golf Company Common Stock,N, ,False,100.0,False,,ELY,ELY,False
EMAG,True,VanEck Vectors Emerging Markets Aggregate Bond ETF,P, ,True,100.0,False,,EMAG,EMAG,False
EMAN,True,eMagin Corporation Common Stock,A, ,False,100.0,False,,EMAN,EMAN,False
EMB,True,iShares J.P. Morgan USD Emerging Markets Bond ETF,Q,G,True,100.0,False,N,,EMB,False
EMBH,True,iShares Interest Rate Hedged Emerging Markets Bond ETF,P, ,True,100.0,False,,EMBH,EMBH,False
EMBU,True,Direxion Funds Direxion Daily Emerging Markets Bond Bull 3X Shares,P, ,True,100.0,False,,EMBU,EMBU,False
EMCB,True,WisdomTree Emerging Markets Corporate Bond Fund,Q,G,True,100.0,False,N,,EMCB,False
EMCF,True,Emclaire Financial Corp - Common Stock,Q,S,False,100.0,False,N,,EMCF,False
EMCG,True,WisdomTree Emerging Markets Consumer Growth Fund,Q,G,True,100.0,False,N,,EMCG,False
EMCI,True,EMC Insurance Group Inc. - Common Stock,Q,Q,False,100.0,False,N,,EMCI,False
EMD,True,Western Asset Emerging Markets Debt Fund Inc Common Stock,N, ,False,100.0,False,,EMD,EMD,False
EMDV,True,ProShares MSCI Emerging Markets Dividend Growers ETF,Z, ,True,100.0,False,,EMDV,EMDV,False
EME,True,"EMCOR Group, Inc. Common Stock",N, ,False,100.0,False,,EME,EME,False
EMEM,True,Virtus Glovista Emerging  Markets ETF,P, ,True,100.0,False,,EMEM,EMEM,False
EMES,True,Emerge Energy Services LP Common Units representing Limited Partner Interests,N, ,False,100.0,False,,EMES,EMES,False
EMF,True,Templeton Emerging Markets Fund Common Stock,N, ,False,100.0,False,,EMF,EMF,False
EMFM,True,Global X Next Emerging & Frontier ETF,P, ,True,100.0,False,,EMFM,EMFM,False
EMGF,True,iShares Edge MSCI Multifactor Emerging Markets ETF,Z, ,True,100.0,False,,EMGF,EMGF,False
EMHY,True,iShares Emerging Markets High Yield Bond ETF,Z, ,True,100.0,False,,EMHY,EMHY,False
EMI,True,Eaton Vance Michigan Municipal Income Trust Shares of Beneficial Interest,A, ,False,100.0,False,,EMI,EMI,False
EMIF,True,iShares S&P Emerging Markets Infrastructure Index Fund,Q,G,True,100.0,False,N,,EMIF,False
EMIH,True,Xtrackers Emerging Markets Bond - Interest Rate Hedged ETF,Z, ,True,100.0,False,,EMIH,EMIH,False
EMITF,True,Elbit Imaging Ltd. - Ordinary Shares,Q,Q,False,100.0,False,N,,EMITF,False
EMJ,True,"Eaton Vance New Jersey Municipal Bond Fund Common Shres of Beneficial Interest, $.01 par value",A, ,False,100.0,False,,EMJ,EMJ,False
EMKR,True,EMCORE Corporation - Common Stock,Q,G,False,100.0,False,N,,EMKR,False
EML,True,Eastern Company (The) - Common Stock,Q,G,False,100.0,False,N,,EML,False
EMLB,True,iPath Long Enhanced MSCI Emerging Markets Index ETN,P, ,False,100.0,False,,EMLB,EMLB,False
EMLC,True,VanEck Vectors J.P. Morgan EM Local Currency Bond ETF,P, ,True,100.0,False,,EMLC,EMLC,False
EMLP,True,First Trust North American Energy Infrastructure Fund,P, ,True,100.0,False,,EMLP,EMLP,False
EMMS,True,Emmis Communications Corporation - Class A Common Stock,Q,Q,False,100.0,False,N,,EMMS,False
EMN,True,Eastman Chemical Company Common Stock,N, ,False,100.0,False,,EMN,EMN,False
EMO,True,ClearBridge Energy MLP Opportunity Fund Inc. Common Stock,N, ,False,100.0,False,,EMO,EMO,False
EMP,True,"Entergy Mississippi, Inc. First Mortgage Bonds, 4.90% Series Due October 1, 2066",N, ,False,100.0,False,,EMP,EMP,False
EMQQ,True,Emerging Markets Internet and Ecommerce ETF (The),P, ,True,100.0,False,,EMQQ,EMQQ,False
EMR,True,Emerson Electric Company Common Stock,N, ,False,100.0,False,,EMR,EMR,False
EMSH,True,ProShares Short Term USD Emerging Markets Bond ETF,Z, ,True,100.0,False,,EMSH,EMSH,False
EMTL,True,SPDR DoubleLine Emerging Markets Fixed Income ETF,Z, ,True,100.0,False,,EMTL,EMTL,False
EMTY,True,ProShares Decline of the Retail Store ETF,P, ,True,100.0,False,,EMTY,EMTY,False
EMX,True,EMX Royalty Corporation Common Shares (Canada),A, ,False,100.0,False,,EMX,EMX,False
EMXC,True,iShares MSCI Emerging Markets ex China ETF,Q,G,True,100.0,False,N,,EMXC,False
ENB,True,Enbridge Inc Common Stock,N, ,False,100.0,False,,ENB,ENB,False
ENBL,True,"Enable Midstream Partners, LP Common Units representing limited partner interests",N, ,False,100.0,False,,ENBL,ENBL,False
ENDP,True,Endo International plc - Ordinary Shares,Q,Q,False,100.0,False,N,,ENDP,False
ENFC,True,Entegra Financial Corp. - Common Stock,Q,G,False,100.0,False,N,,ENFC,False
ENFR,True,Alerian Energy Infrastructure ETF,P, ,True,100.0,False,,ENFR,ENFR,False
ENG,True,ENGlobal Corporation - Common Stock,Q,S,False,100.0,False,D,,ENG,False
ENIA,True,Enel Americas S.A. American Depositary Shares,N, ,False,100.0,False,,ENIA,ENIA,False
ENIC,True,Enel Chile S.A. American Depositary Shares (Each representing 50 shares of Common Stock),N, ,False,100.0,False,,ENIC,ENIC,False
ENJ,True,"Entergy New Orleans, LLC First Mortgage Bonds, 5.0% Series due December 1, 2052",N, ,False,100.0,False,,ENJ,ENJ,False
ENLC,True,"EnLink Midstream, LLC Common Units representing Limited Partner Interests",N, ,False,100.0,False,,ENLC,ENLC,False
ENLK,True,"EnLink Midstream Partners, LP Common Units Representing Limited Partnership Interests",N, ,False,100.0,False,,ENLK,ENLK,False
ENO,True,"Entergy New Orleans, LLC First Mortgage Bonds, 5.50% Series due April 1, 2066",N, ,False,100.0,False,,ENO,ENO,False
ENOR,True,iShares Inc iShares MSCI Norway ETF,Z, ,True,100.0,False,,ENOR,ENOR,False
ENPH,True,"Enphase Energy, Inc. - Common Stock",Q,G,False,100.0,False,N,,ENPH,False
ENR,True,"Energizer Holdings, Inc. Common Stock",N, ,False,100.0,False,,ENR,ENR,False
ENS,True,Enersys Common Stock,N, ,False,100.0,False,,ENS,ENS,False
ENSG,True,"The Ensign Group, Inc. - Common Stock",Q,Q,False,100.0,False,N,,ENSG,False
ENSV,True,Enservco Corporation Common Stock,A, ,False,100.0,False,,ENSV,ENSV,False
ENT,True,Global Eagle Entertainment Inc. - Common Stock,Q,S,False,100.0,False,N,,ENT,False
ENTA,True,"Enanta Pharmaceuticals, Inc. - Common Stock",Q,Q,False,100.0,False,N,,ENTA,False
ENTG,True,"Entegris, Inc. - Common Stock",Q,Q,False,100.0,False,N,,ENTG,False
ENTR,True,ERShares Entrepreneur 30 ETF,P, ,True,100.0,False,,ENTR,ENTR,False
ENV,True,"Envestnet, Inc Common Stock",N, ,False,100.0,False,,ENV,ENV,False
ENVA,True,"Enova International, Inc. Common Stock",N, ,False,100.0,False,,ENVA,ENVA,False
ENX,True,"Eaton Vance New York Municipal Bond Fund Common Shares of Beneficial Interest, $.01 par value",A, ,False,100.0,False,,ENX,ENX,False
ENY,True,Guggenheim Canadian Energy Income ETF,P, ,True,100.0,False,,ENY,ENY,False
