Symbol,Nasdaq Traded,Security Name,Listing Exchange,Market Category,ETF,Round Lot Size,Test Issue,Financial Status,CQS Symbol,NASDAQ Symbol,NextShares
PSX,True,Phillips 66 Common Stock,N, ,False,100.0,False,,PSX,PSX,False
PSXP,True,Phillips 66 Partners LP Common Units representing limited partner interest in the Partnership,N, ,False,100.0,False,,PSXP,PSXP,False
PTC,True,PTC Inc. - Common Stock,Q,Q,False,100.0,False,N,,PTC,False
PTCT,True,"PTC Therapeutics, Inc. - Common Stock",Q,Q,False,100.0,False,N,,PTCT,False
PTEN,True,"Patterson-UTI Energy, Inc. - Common Stock",Q,Q,False,100.0,False,N,,PTEN,False
PTEU,True,Pacer TrendpilotTM European Index ETF,Z, ,True,100.0,False,,PTEU,PTEU,False
PTF,True,PowerShares DWA Technology Momenum Portfolio,Q,G,True,100.0,False,N,,PTF,False
PTGX,True,"Protagonist Therapeutics, Inc. - Common Stock",Q,G,False,100.0,False,N,,PTGX,False
PTH,True,PowerShares DWA Healthcare Momentum Portfolio,Q,G,True,100.0,False,N,,PTH,False
PTI,True,"Proteostasis Therapeutics, Inc. - Common Stock",Q,G,False,100.0,False,N,,PTI,False
PTIE,True,"Pain Therapeutics, Inc. - Common Stock",Q,Q,False,100.0,False,D,,PTIE,False
PTLA,True,"Portola Pharmaceuticals, Inc. - Common Stock",Q,Q,False,100.0,False,N,,PTLA,False
PTLC,True,Pacer Trendpilot US Large Cap ETF,Z, ,True,100.0,False,,PTLC,PTLC,False
PTM,True,E-TRACS USB Bloomberg Commodity Index Exchange Traded Notes E-TRACS UBS Bloomberg CMCI Platinum ETN,P, ,False,100.0,False,,PTM,PTM,False
PTMC,True,Pacer Trendpilot US Mid Cap ETF,Z, ,True,100.0,False,,PTMC,PTMC,False
PTN,True,"Palatin Technologies, Inc. Common Stock",A, ,False,100.0,False,,PTN,PTN,False
PTNQ,True,Pacer Trendpilot 100 ETF,Z, ,True,100.0,False,,PTNQ,PTNQ,False
PTNR,True,"Partner Communications Company Ltd. - American Depositary Shares, each representing one ordinary share",Q,Q,False,100.0,False,N,,PTNR,False
PTR,True,PetroChina Company Limited Common Stock,N, ,False,100.0,False,,PTR,PTR,False
PTSI,True,"P.A.M. Transportation Services, Inc. - Common Stock",Q,G,False,100.0,False,N,,PTSI,False
PTX,True,"Pernix Therapeutics Holdings, Inc. - Common Stock",Q,G,False,100.0,False,N,,PTX,False
PTY,True,Pimco Corporate & Income Opportunity Fund,N, ,False,100.0,False,,PTY,PTY,False
PUB,True,People's Utah Bancorp - Common Stock,Q,S,False,100.0,False,N,,PUB,False
PUI,True,PowerShares DWA Utilities Momentum Portfolio,Q,G,True,100.0,False,N,,PUI,False
PUK,True,Prudential Public Limited Company Common Stock,N, ,False,100.0,False,,PUK,PUK,False
PUK$,True,Prudential Public Limited Company 6.75% Perpetual Subordinated Captial Security,N, ,False,100.0,False,,PUKp,PUK-,False
PUK$A,True,Prudential Public Limited Company 6.50% Perpetual Subordinated Capital Securities Exchangeable at the Issuer's Option Into Non-Cumulative Dollar Denominated Preference Shares,N, ,False,100.0,False,,PUKpA,PUK-A,False
PULM,True,"Pulmatrix, Inc. - Common Stock",Q,G,False,100.0,False,N,,PULM,False
PUMP,True,ProPetro Holding Corp. Common Stock,N, ,False,100.0,False,,PUMP,PUMP,False
PUTW,True,WisdomTree CBOE S&P 500 PutWrite Strategy Fund,P, ,True,100.0,False,,PUTW,PUTW,False
PUW,True,PowerShares WilderHill Progressive Energy Portfolio,P, ,True,100.0,False,,PUW,PUW,False
PVAC,True,Penn Virginia Corporation - Common Stock,Q,Q,False,100.0,False,D,,PVAC,False
PVAL,True,Principal Contrarian Value Index ETF,Q,G,True,100.0,False,N,,PVAL,False
PVBC,True,"Provident Bancorp, Inc. - Common Stock",Q,S,False,100.0,False,N,,PVBC,False
PVG,True,"Pretium Resources, Inc. Ordinary Shares (Canada)",N, ,False,100.0,False,,PVG,PVG,False
PVH,True,PVH Corp. Common Stock,N, ,False,100.0,False,,PVH,PVH,False
PVI,True,PowerShares VRDO Tax Free Weekly Portfolio,P, ,True,100.0,False,,PVI,PVI,False
PW,True,Power REIT (MD) Common Stock,A, ,False,100.0,False,,PW,PW,False
PW$A,True,Power REIT 7.75% Series A Cumulative Perpetual Preferred Stock,A, ,False,100.0,False,,PWpA,PW-A,False
PWB,True,PowerShares Dynamic LargeCap Growth,P, ,True,100.0,False,,PWB,PWB,False
PWC,True,PowerShares XTF: Dynamic Market Portfolio,P, ,True,100.0,False,,PWC,PWC,False
PWOD,True,"Penns Woods Bancorp, Inc. - Common Stock",Q,Q,False,100.0,False,N,,PWOD,False
PWR,True,"Quanta Services, Inc. Common Stock",N, ,False,100.0,False,,PWR,PWR,False
PWS,True,Pacer WealthShield ETF ,Z, ,True,100.0,False,,PWS,PWS,False
PWV,True,PowerShares Dynamic LargeCap Value,P, ,True,100.0,False,,PWV,PWV,False
PWZ,True,PowerShares California AMT-Free Municipal Bond Portfolio,P, ,True,100.0,False,,PWZ,PWZ,False
PX,True,"Praxair, Inc. Common Stock",N, ,False,100.0,False,,PX,PX,False
PXD,True,Pioneer Natural Resources Company Common Stock,N, ,False,100.0,False,,PXD,PXD,False
PXE,True,PowerShares Dynamic Energy E&P,P, ,True,100.0,False,,PXE,PXE,False
PXF,True,PowerShares FTSE RAFI Developed Markets ex-U.S. Portfolio,P, ,True,100.0,False,,PXF,PXF,False
PXH,True,PowerShares FTSE RAFI Emerging Markets Portfolio,P, ,True,100.0,False,,PXH,PXH,False
PXI,True,PowerShares DWA Energy Momentum Portfolio,Q,G,True,100.0,False,N,,PXI,False
PXJ,True,PowerShares Dynamic Oil Services,P, ,True,100.0,False,,PXJ,PXJ,False
PXLG,True,PowerShares Russell Top 200 Pure Growth Portfolio,P, ,True,100.0,False,,PXLG,PXLG,False
PXLV,True,PowerShares Russell Top 200 Pure Value Portfolio,P, ,True,100.0,False,,PXLV,PXLV,False
PXLW,True,"Pixelworks, Inc. - Common Stock",Q,G,False,100.0,False,N,,PXLW,False
PXMG,True,PowerShares Russell Midcap Pure Growth Portfolio,P, ,True,100.0,False,,PXMG,PXMG,False
PXMV,True,PowerShares Russell Midcap Pure Value Portfolio,P, ,True,100.0,False,,PXMV,PXMV,False
PXQ,True,PowerShares Dynamic Networking,P, ,True,100.0,False,,PXQ,PXQ,False
PXR,True,PowerShares Global Emerging Markets Infrastructure,P, ,True,100.0,False,,PXR,PXR,False
PXS,True,Pyxis Tankers Inc. - Common Stock,Q,S,False,100.0,False,N,,PXS,False
PXSG,True,PowerShares Russell 2000 Pure Growth Portfolio,P, ,True,100.0,False,,PXSG,PXSG,False
PXSV,True,PowerShares Russell 2000 Pure Value Portfolio,P, ,True,100.0,False,,PXSV,PXSV,False
PXUS,True,Principal International Multi-Factor Index ETF,Q,G,True,100.0,False,N,,PXUS,False
PY,True,Principal Shareholder Yield Index ETF,Q,G,True,100.0,False,N,,PY,False
PYDS,True,"Payment Data Systems, Inc. - Common Stock",Q,S,False,100.0,False,N,,PYDS,False
PYN,True,PIMCO New York Municipal Income Fund III Common Shares of Beneficial Interest,N, ,False,100.0,False,,PYN,PYN,False
PYPL,True,"PayPal Holdings, Inc. - Common Stock",Q,Q,False,100.0,False,N,,PYPL,False
PYS,True,Merrill Lynch Depositor Inc PPlus Tr Ser RRD-1 Tr Ctf Cl A,N, ,False,100.0,False,,PYS,PYS,False
PYT,True,PPlus Tr GSC-2 Tr Ctf Fltg Rate,N, ,False,100.0,False,,PYT,PYT,False
PYZ,True,PowerShares DWA Basic Materials Momentum Portfolio,Q,G,True,100.0,False,N,,PYZ,False
PZA,True,PowerShares National AMT-Free Municipal Bond Portfolio,P, ,True,100.0,False,,PZA,PZA,False
PZC,True,PIMCO California Municipal Income Fund III Common Shares of Beneficial Interest,N, ,False,100.0,False,,PZC,PZC,False
PZD,True,PowerShares Cleantech Portfolio,P, ,True,100.0,False,,PZD,PZD,False
PZE,True,Petrobras Argentina S.A. ADS,N, ,False,100.0,False,,PZE,PZE,False
PZG,True,Paramount Gold Nevada Corp. Common Stock,A, ,False,100.0,False,,PZG,PZG,False
PZI,True,PowerShares Zacks Micro Cap,P, ,True,100.0,False,,PZI,PZI,False
PZN,True,Pzena Investment Management Inc Class A Common Stock,N, ,False,100.0,False,,PZN,PZN,False
PZT,True,PowerShares New York AMT-Free Municipal Bond Portfolio,P, ,True,100.0,False,,PZT,PZT,False
PZZA,True,"Papa John's International, Inc. - Common Stock",Q,Q,False,100.0,False,N,,PZZA,False
QABA,True,First Trust NASDAQ ABA Community Bank Index Fund,Q,G,True,100.0,False,N,,QABA,False
QADA,True,QAD Inc. - Class A Common Stock,Q,Q,False,100.0,False,N,,QADA,False
QADB,True,QAD Inc. - Class B Common Stock,Q,Q,False,100.0,False,N,,QADB,False
QAI,True,IQ Hedge MultiIQ Hedge Multi-Strategy Tracker ETF,P, ,True,100.0,False,,QAI,QAI,False
QAT,True,iShares MSCI Qatar ETF,Q,G,True,100.0,False,N,,QAT,False
QBAK,True,Qualstar Corporation - Common Stock,Q,S,False,100.0,False,N,,QBAK,False
QCAN,True,SPDR MSCI Canada StrategicFactors ETF,P, ,True,100.0,False,,QCAN,QCAN,False
QCLN,True,First Trust NASDAQ Clean Edge Green Energy Index Fund,Q,G,True,100.0,False,N,,QCLN,False
QCOM,True,QUALCOMM Incorporated - Common Stock,Q,Q,False,100.0,False,N,,QCOM,False
QCP,True,"Quality Care Properties, Inc. Common Stock ",N, ,False,100.0,False,,QCP,QCP,False
QCRH,True,"QCR Holdings, Inc. - Common Stock",Q,G,False,100.0,False,N,,QCRH,False
QD,True,"Qudian Inc. American Depositary Shares, each representing one Class A Ordinary Share",N, ,False,100.0,False,,QD,QD,False
QDEF,True,FlexShares Quality Dividend Defensive Index Fund,P, ,True,100.0,False,,QDEF,QDEF,False
QDEL,True,Quidel Corporation - Common Stock,Q,Q,False,100.0,False,N,,QDEL,False
QDEU,True,SPDR MSCI Germany StrategicFactors ETF,P, ,True,100.0,False,,QDEU,QDEU,False
QDF,True,FlexShares Quality Dividend Index Fund,P, ,True,100.0,False,,QDF,QDF,False
QDYN,True,FlexShares Quality Dynamic Index Fund,P, ,True,100.0,False,,QDYN,QDYN,False
QED,True,IQ Hedge Event-Driven Tracker ETF,P, ,True,100.0,False,,QED,QED,False
QEFA,True,SPDR MSCI EAFE StrategicFactors ETF,P, ,True,100.0,False,,QEFA,QEFA,False
QEMM,True,SPDR MSCI Emerging Markets StrategicFactors ETF,P, ,True,100.0,False,,QEMM,QEMM,False
QEP,True,"QEP Resources, Inc. Common Stock",N, ,False,100.0,False,,QEP,QEP,False
QES,True,Quintana Energy Services Inc. Common Stock,N, ,False,100.0,False,,QES,QES,False
QGBR,True,SPDR MSCI United Kingdom StrategicFactors ETF,P, ,True,100.0,False,,QGBR,QGBR,False
QGEN,True,Qiagen N.V. Common Shares ,N, ,False,100.0,False,,QGEN,QGEN,False
QGTA,True,IQ Leaders GTAA Tracker ETF,P, ,True,100.0,False,,QGTA,QGTA,False
QHC,True,Quorum Health Corporation Common Stock ,N, ,False,100.0,False,,QHC,QHC,False
QID,True,ProShares UltraShort QQQ,P, ,True,100.0,False,,QID,QID,False
QINC,True,First Trust RBA Quality Income ETF,Q,G,True,100.0,False,N,,QINC,False
QIWI,True,QIWI plc - American Depositary Shares,Q,Q,False,100.0,False,N,,QIWI,False
QJPN,True,SPDR MSCI Japan StrategicFactors ETF,P, ,True,100.0,False,,QJPN,QJPN,False
QLC,True,FlexShares US Quality Large Cap Index Fund,Q,G,True,100.0,False,N,,QLC,False
QLD,True,ProShares Ultra QQQ,P, ,True,100.0,False,,QLD,QLD,False
QLS,True,IQ Hedge Long Short Tracker ETF,P, ,True,100.0,False,,QLS,QLS,False
QLTA,True,iShares Aaa A Rated Corporate Bond ETF,P, ,True,100.0,False,,QLTA,QLTA,False
QLYS,True,"Qualys, Inc. - Common Stock",Q,Q,False,100.0,False,N,,QLYS,False
QMN,True,IQ Hedge Market Neutral Tracker ETF,P, ,True,100.0,False,,QMN,QMN,False
QMOM,True,Alpha Architect U.S. Quantitative Momentum ETF,Z, ,True,100.0,False,,QMOM,QMOM,False
QNST,True,"QuinStreet, Inc. - Common Stock",Q,Q,False,100.0,False,N,,QNST,False
QQEW,True,First Trust NASDAQ-100 Equal Weighted Index Fund,Q,G,True,100.0,False,N,,QQEW,False
QQQ,True,"PowerShares QQQ Trust, Series 1",Q,G,True,100.0,False,N,,QQQ,False
QQQC,True,Global X NASDAQ China Technology ETF,Q,G,True,100.0,False,N,,QQQC,False
QQQE,True,Direxion NASDAQ-100 Equal Weighted Index Shares,P, ,True,100.0,False,,QQQE,QQQE,False
QQQX,True,Nuveen NASDAQ 100 Dynamic Overwrite Fund - Shares of Beneficial Interest,Q,Q,False,100.0,False,N,,QQQX,False
QQXT,True,First Trust NASDAQ-100 Ex-Technology Sector Index Fund,Q,G,True,100.0,False,N,,QQXT,False
QRHC,True,Quest Resource Holding Corporation. - Common Stock,Q,S,False,100.0,False,N,,QRHC,False
QRTEA,True,Liberty Interactive Corporation - Series A QVC Group Common Stock,Q,Q,False,100.0,False,N,,QRTEA,False
QRTEB,True,Liberty Interactive Corporation - Series B QVC Group Common Stock,Q,Q,False,100.0,False,N,,QRTEB,False
QRVO,True,"Qorvo, Inc. - Common Stock",Q,Q,False,100.0,False,N,,QRVO,False
QSII,True,"Quality Systems, Inc. - Common Stock",Q,Q,False,100.0,False,N,,QSII,False
QSR,True,Restaurant Brands International Inc. Common Shares,N, ,False,100.0,False,,QSR,QSR,False
QSY,True,WisdomTree U.S. Quality Shareholder Yield Fund,P, ,True,100.0,False,,QSY,QSY,False
QTEC,True,First Trust NASDAQ-100- Technology Index Fund,Q,G,True,100.0,False,N,,QTEC,False
QTM,True,Quantum Corporation Common Stock,N, ,False,100.0,False,,QTM,QTM,False
QTNA,True,"Quantenna Communications, Inc. - Common Stock",Q,Q,False,100.0,False,N,,QTNA,False
QTNT,True,Quotient Limited - Ordinary Shares,Q,G,False,100.0,False,N,,QTNT,False
QTRH,True,Quarterhill Inc. - Common Shares,Q,Q,False,100.0,False,N,,QTRH,False
QTRX,True,Quanterix Corporation - Common Stock,Q,G,False,100.0,False,N,,QTRX,False
QTS,True,"QTS Realty Trust, Inc. Class A Common Stock",N, ,False,100.0,False,,QTS,QTS,False
QTS$A,True,"QTS Realty Trust, Inc. 7.125% Series A Cumulative Redeemable Perpetual Preferred Stock",N, ,False,100.0,False,,QTSpA,QTS-A,False
QTWO,True,"Q2 Holdings, Inc. Common Stock",N, ,False,100.0,False,,QTWO,QTWO,False
QUAD,True,"Quad Graphics, Inc Class A Common Stock",N, ,False,100.0,False,,QUAD,QUAD,False
QUAL,True,iShares Edge MSCI USA Quality Factor ETF,Z, ,True,100.0,False,,QUAL,QUAL,False
QUIK,True,QuickLogic Corporation - Common Stock,Q,G,False,100.0,False,N,,QUIK,False
QUMU,True,Qumu Corporation - Common Stock,Q,Q,False,100.0,False,N,,QUMU,False
QUOT,True,Quotient Technology Inc. Common Stock,N, ,False,100.0,False,,QUOT,QUOT,False
QURE,True,uniQure N.V. - Ordinary Shares,Q,Q,False,100.0,False,N,,QURE,False
QUS,True,SPDR MSCI USA StrategicFactors ETF,P, ,True,100.0,False,,QUS,QUS,False
QVAL,True,Alpha Architect U.S. Quantitative Value ETF,Z, ,True,100.0,False,,QVAL,QVAL,False
QVM,True,Arrow QVM Equity Factor ETF,P, ,True,100.0,False,,QVM,QVM,False
QWLD,True,SPDR MSCI World StrategicFactors ETF,P, ,True,100.0,False,,QWLD,QWLD,False
QXGG,True,QuantX Risk Managed Growth ETF ETF,Z, ,True,100.0,False,,QXGG,QXGG,False
QXMI,True,QuantX Risk Managed Multi-Asset Income ETF,Z, ,True,100.0,False,,QXMI,QXMI,False
QXRR,True,QuantX Risk Managed Real Return ETF,Z, ,True,100.0,False,,QXRR,QXRR,False
QXTR,True,QuantX Risk Managed Multi-Asset Total Return ETF,Z, ,True,100.0,False,,QXTR,QXTR,False
QYLD,True,Horizons NASDAQ-100 Covered Call ETF,Q,G,True,100.0,False,N,,QYLD,False
R,True,"Ryder System, Inc. Common Stock",N, ,False,100.0,False,,R,R,False
RA,True,Brookfield Real Assets Income Fund Inc. Common Stock,N, ,False,100.0,False,,RA,RA,False
RACE,True,Ferrari N.V. Common Shares,N, ,False,100.0,False,,RACE,RACE,False
RAD,True,Rite Aid Corporation Common Stock,N, ,False,100.0,False,,RAD,RAD,False
RADA,True,RADA Electronic Industries Ltd. - Ordinary Shares,Q,S,False,100.0,False,N,,RADA,False
RAIL,True,"Freightcar America, Inc. - Common Stock",Q,Q,False,100.0,False,N,,RAIL,False
RALS,True,ProShares RAFI Long Short ETF,P, ,True,100.0,False,,RALS,RALS,False
RAND,True,Rand Capital Corporation - Common Stock ($0.10 Par Value),Q,S,False,100.0,False,N,,RAND,False
RARE,True,Ultragenyx Pharmaceutical Inc. - Common Stock,Q,Q,False,100.0,False,N,,RARE,False
RARX,True,"Ra Pharmaceuticals, Inc. - Common Stock",Q,G,False,100.0,False,N,,RARX,False
RAS,True,RAIT Financial Trust New Common Shares of Beneficial Interest,N, ,False,100.0,False,,RAS,RAS,False
RAS$A,True,RAIT Financial Trust  7.75% Series A Cumulative Redeemable Preferred Shares of Beneficial Interest,N, ,False,100.0,False,,RASpA,RAS-A,False
RAS$B,True,RAIT Financial Trust 8.375% Series B Cumulative Redeemable Preferred Shares of Beneficial Interest,N, ,False,100.0,False,,RASpB,RAS-B,False
RAS$C,True,RAIT Financial Trust 8.875% Series C Cumulative Redeemable Preferred Shares of Beneficial Interest,N, ,False,100.0,False,,RASpC,RAS-C,False
RAVE,True,"Rave Restaurant Group, Inc. - Common Stock",Q,S,False,100.0,False,N,,RAVE,False
RAVI,True,FlexShares Ready Access Variable Income Fund,P, ,True,100.0,False,,RAVI,RAVI,False
RAVN,True,"Raven Industries, Inc. - Common Stock",Q,Q,False,100.0,False,N,,RAVN,False
RBA,True,Ritchie Bros. Auctioneers Incorporated Common Stock,N, ,False,100.0,False,,RBA,RBA,False
RBB,True,RBB Bancorp - Common Stock,Q,Q,False,100.0,False,N,,RBB,False
RBBN,True,Ribbon Communications Inc.  - Common Stock,Q,Q,False,100.0,False,N,,RBBN,False
RBC,True,Regal Beloit Corporation Common Stock,N, ,False,100.0,False,,RBC,RBC,False
RBCAA,True,"Republic Bancorp, Inc. - Class A Common Stock",Q,Q,False,100.0,False,N,,RBCAA,False
RBCN,True,"Rubicon Technology, Inc. - Common Stock",Q,S,False,100.0,False,N,,RBCN,False
RBIN,True,Nationwide Risk-Based International Equity ETF,P, ,True,100.0,False,,RBIN,RBIN,False
RBNC,True,"Reliant Bancorp, Inc. - Common Stock",Q,S,False,100.0,False,N,,RBNC,False
RBS,True,Royal Bank of Scotland Group Plc New (The) ADS,N, ,False,100.0,False,,RBS,RBS,False
RBS$S,True,Royal Bank of Scotland Group Plc (The) Sponsored ADR Repstg Pref Ser S (United Kingdom),N, ,False,100.0,False,,RBSpS,RBS-S,False
RBUS,True,Nationwide Risk-Based U.S. Equity ETF,P, ,True,100.0,False,,RBUS,RBUS,False
RCD,True,Guggenheim S&P 500 Equal Weight Consumer Discretionary ETF,P, ,True,100.0,False,,RCD,RCD,False
RCG,True,"RENN Fund, Inc Common Stock",A, ,False,100.0,False,,RCG,RCG,False
RCI,True,"Rogers Communication, Inc. Common Stock",N, ,False,100.0,False,,RCI,RCI,False
RCII,True,Rent-A-Center Inc. - Common Stock,Q,Q,False,100.0,False,N,,RCII,False
RCKT,True,"Rocket Pharmaceuticals, Inc. - Common Stock",Q,G,False,100.0,False,N,,RCKT,False
RCKY,True,"Rocky Brands, Inc. - Common Stock",Q,Q,False,100.0,False,N,,RCKY,False
RCL,True,Royal Caribbean Cruises Ltd. Common Stock,N, ,False,100.0,False,,RCL,RCL,False
RCM,True,R1 RCM Inc. - Common Stock,Q,G,False,100.0,False,N,,RCM,False
RCMT,True,"RCM Technologies, Inc. - Common Stock",Q,G,False,100.0,False,N,,RCMT,False
RCOM,True,Elkhorn ETF Trust ETF,Z, ,True,100.0,False,,RCOM,RCOM,False
RCON,True,"Recon Technology, Ltd. - Ordinary Shares",Q,S,False,100.0,False,N,,RCON,False
RCS,True,"PIMCO Strategic Income Fund, Inc.",N, ,False,100.0,False,,RCS,RCS,False
RCUS,True,"Arcus Biosciences, Inc. Common Stock",N, ,False,100.0,False,,RCUS,RCUS,False
RDC,True,Rowan Companies plc Class A Ordinary Shares,N, ,False,100.0,False,,RDC,RDC,False
RDCM,True,Radcom Ltd. - Ordinary Shares,Q,S,False,100.0,False,N,,RDCM,False
RDFN,True,Redfin Corporation - Common Stock,Q,Q,False,100.0,False,N,,RDFN,False
RDHL,True,Redhill Biopharma Ltd. - American Depositary Shares,Q,S,False,100.0,False,N,,RDHL,False
RDI,True,Reading International Inc - Class A Non-voting Common Stock,Q,S,False,100.0,False,N,,RDI,False
RDIB,True,Reading International Inc - Class B Voting Common Stock,Q,S,False,100.0,False,N,,RDIB,False
RDIV,True,Oppenheimer Ultra Dividend Revenue ETF,P, ,True,100.0,False,,RDIV,RDIV,False
RDN,True,Radian Group Inc. Common Stock,N, ,False,100.0,False,,RDN,RDN,False
RDNT,True,"RadNet, Inc. - Common Stock",Q,G,False,100.0,False,N,,RDNT,False
RDS.A,True,Royal Dutch Shell PLC Royal Dutch Shell American Depositary Shares (Each representing two Class A Ordinary Shares),N, ,False,100.0,False,,RDS.A,RDS.A,False
RDS.B,True,Royal Dutch Shell PLC Royal Dutch Shell PLC American Depositary Shares (Each representing two Class B Ordinary Shares),N, ,False,100.0,False,,RDS.B,RDS.B,False
RDUS,True,"Radius Health, Inc. - Common Stock",Q,G,False,100.0,False,N,,RDUS,False
RDVT,True,"Red Violet, Inc. - Common Stock ",Q,S,False,100.0,False,N,,RDVT,False
RDVY,True,First Trust Rising Dividend Achievers ETF,Q,G,True,100.0,False,N,,RDVY,False
RDWR,True,Radware Ltd. - Ordinary Shares,Q,Q,False,100.0,False,N,,RDWR,False
RDY,True,Dr. Reddy's Laboratories Ltd Common Stock,N, ,False,100.0,False,,RDY,RDY,False
RE,True,"Everest Re Group, Ltd. Common Stock",N, ,False,100.0,False,,RE,RE,False
RECN,True,"Resources Connection, Inc. - Common Stock",Q,Q,False,100.0,False,N,,RECN,False
REDU,True,RISE Education Cayman Ltd - American Depositary Shares,Q,G,False,100.0,False,N,,REDU,False
REED,True,"Reeds, Inc. Common Stock",A, ,False,100.0,False,,REED,REED,False
REEM,True,Oppenheimer Revenue Weighted ETF Trust ETF,Z, ,True,100.0,False,,REEM,REEM,False
REET,True,iShares Trust iShares Global REIT ETF,P, ,True,100.0,False,,REET,REET,False
REFA,True,Oppenheimer International Revenue ETF,Z, ,True,100.0,False,,REFA,REFA,False
REFR,True,Research Frontiers Incorporated - Common Stock,Q,S,False,100.0,False,D,,REFR,False
REG,True,Regency Centers Corporation Common Stock,N, ,False,100.0,False,,REG,REG,False
REGI,True,"Renewable Energy Group, Inc. - Common Stock",Q,Q,False,100.0,False,N,,REGI,False
REGL,True,ProShares S&P MidCap 400 Dividend Aristocrats ETF,Z, ,True,100.0,False,,REGL,REGL,False
REGN,True,"Regeneron Pharmaceuticals, Inc. - Common Stock",Q,Q,False,100.0,False,N,,REGN,False
REI,True,"Ring Energy, Inc. Common Stock",A, ,False,100.0,False,,REI,REI,False
REIS,True,"Reis, Inc - Common Stock",Q,Q,False,100.0,False,N,,REIS,False
REK,True,ProShares Short Real Estate,P, ,True,100.0,False,,REK,REK,False
RELL,True,"Richardson Electronics, Ltd. - Common Stock",Q,Q,False,100.0,False,N,,RELL,False
RELV,True,"Reliv' International, Inc. - Common Stock",Q,S,False,100.0,False,N,,RELV,False
RELX,True,RELX PLC PLC American Depositary Shares (Each representing One Ordinary Share),N, ,False,100.0,False,,RELX,RELX,False
REM,True,iShares Trust iShares Mortgage Real Estate ETF,Z, ,True,100.0,False,,REM,REM,False
REML,True,"Credit Suisse AG Credit Suisse X-Links Monthly Pay 2xLeveraged Mortgage REIT Exchange Traded Notes (ETNs) due July 11, 2036",P, ,False,100.0,False,,REML,REML,False
REMX,True,VanEck Vectors Rare Earth Strategic Metals ETF,P, ,True,100.0,False,,REMX,REMX,False
REN,True,Resolute Energy Corporation Comon Stock,N, ,False,100.0,False,,REN,REN,False
RENN,True,"Renren Inc. American Depositary Shares, each representing fifteen Class A ordinary shares",N, ,False,100.0,False,,RENN,RENN,False
RENX,True,RELX N.V. American Depositary Shares (Each representing One Ordinary Share),N, ,False,100.0,False,,RENX,RENX,False
REPH,True,"Recro Pharma, Inc. - Common Stock",Q,S,False,100.0,False,N,,REPH,False
RES,True,"RPC, Inc. Common Stock",N, ,False,100.0,False,,RES,RES,False
RESI,True,Front Yard Residential Corporation Common Stock,N, ,False,100.0,False,,RESI,RESI,False
RESN,True,Resonant Inc. - Common Stock,Q,S,False,100.0,False,N,,RESN,False
RETA,True,"Reata Pharmaceuticals, Inc. - Class A Common Stock",Q,G,False,100.0,False,N,,RETA,False
RETL,True,Direxion Daily Retail Bull 3X Shares ETF,P, ,True,100.0,False,,RETL,RETL,False
RETO,True,"ReTo Eco-Solutions, Inc. - Common Shares",Q,S,False,100.0,False,N,,RETO,False
REV,True,"Revlon, Inc. New Common Stock",N, ,False,100.0,False,,REV,REV,False
REVG,True,"REV Group, Inc. Common Stock",N, ,False,100.0,False,,REVG,REVG,False
REW,True,ProShares UltraShort Technology,P, ,True,100.0,False,,REW,REW,False
REX,True,REX American Resources Corporation,N, ,False,100.0,False,,REX,REX,False
REXR,True,"Rexford Industrial Realty, Inc. Common Stock",N, ,False,100.0,False,,REXR,REXR,False
REXR$A,True,"Rexford Industrial Realty, Inc. 5.875% Series A Cumulative Redeemable Preferred Stock",N, ,False,100.0,False,,REXRpA,REXR-A,False
REXR$B,True,"Rexford Industrial Realty, Inc. 5.875% Series B Cumulative Redeemable Preferred Stock",N, ,False,100.0,False,,REXRpB,REXR-B,False
REXX,True,Rex Energy Corporation - Common Stock,Q,S,False,100.0,False,D,,REXX,False
REZ,True,iShares Trust iShares Residential Real Estate ETF,P, ,True,100.0,False,,REZ,REZ,False
RF,True,Regions Financial Corporation Common Stock,N, ,False,100.0,False,,RF,RF,False
RF$A,True,Regions Financial Corporation Depositary Shares Representing 1/40th Perpetual Preferred Series A,N, ,False,100.0,False,,RFpA,RF-A,False
RF$B,True,Regions Financial Corporation Depositary Shares Representing 1/40th Perpetual Preferred Series B,N, ,False,100.0,False,,RFpB,RF-B,False
RFAP,True,First Trust RiverFront Dynamic Asia Pacific ETF,Q,G,True,100.0,False,N,,RFAP,False
RFCI,True,RiverFront Dynamic Core Income ETF,P, ,True,100.0,False,,RFCI,RFCI,False
RFDA,True,RiverFront Dynamic US Dividend Advantage ETF,P, ,True,100.0,False,,RFDA,RFDA,False
RFDI,True,First Trust RiverFront Dynamic Developed International ETF,Q,G,True,100.0,False,N,,RFDI,False
RFEM,True,First Trust RiverFront Dynamic Emerging Markets ETF,Q,G,True,100.0,False,N,,RFEM,False
RFEU,True,First Trust RiverFront Dynamic Europe ETF,Q,G,True,100.0,False,N,,RFEU,False
RFFC,True,RiverFront Dynamic US Flex-Cap ETF,P, ,True,100.0,False,,RFFC,RFFC,False
RFG,True,Guggenheim S&P Midcap 400 Pure Growth ETF,P, ,True,100.0,False,,RFG,RFG,False
RFI,True,"Cohen & Steers Total Return Realty Fund, Inc. Common Stock",N, ,False,100.0,False,,RFI,RFI,False
RFIL,True,"RF Industries, Ltd. - Common Stock",Q,G,False,100.0,False,N,,RFIL,False
RFL,True,"Rafael Holdings, Inc. Class B Common Stock ",A, ,False,100.0,False,,RFL,RFL,False
RFP,True,Resolute Forest Products Inc. Common Stock,N, ,False,100.0,False,,RFP,RFP,False
RFT,True,RAIT Financial Trust 7.625% Senior Notes due 2024,N, ,False,100.0,False,,RFT,RFT,False
RFTA,True,RAIT Financial Trust 7.125% Senior Notes due 2019,N, ,False,100.0,False,,RFTA,RFTA,False
RFUN,True,RiverFront Dynamic Unconstrained Income ETF,P, ,True,100.0,False,,RFUN,RFUN,False
RFV,True,Guggenheim S&P Midcap 400 Pure Value ETF,P, ,True,100.0,False,,RFV,RFV,False
RGA,True,"Reinsurance Group of America, Incorporated Common Stock",N, ,False,100.0,False,,RGA,RGA,False
RGCO,True,RGC Resources Inc. - Common Stock,Q,G,False,100.0,False,N,,RGCO,False
RGEN,True,Repligen Corporation - Common Stock,Q,Q,False,100.0,False,N,,RGEN,False
RGI,True,Guggenheim S&P 500 Equal Weight Industrials ETF,P, ,True,100.0,False,,RGI,RGI,False
RGLB,True,Oppenheimer Global Revenue ETF,Z, ,True,100.0,False,,RGLB,RGLB,False
RGLD,True,"Royal Gold, Inc. - Common Stock",Q,Q,False,100.0,False,N,,RGLD,False
RGLS,True,Regulus Therapeutics Inc. - Common Stock,Q,G,False,100.0,False,N,,RGLS,False
RGNX,True,REGENXBIO Inc. - Common Stock,Q,Q,False,100.0,False,N,,RGNX,False
RGR,True,"Sturm, Ruger & Company, Inc. Common Stock",N, ,False,100.0,False,,RGR,RGR,False
